erantzunZbkia,gaixotasunCodes,sintomak,gaixotasunNOCodes,gaixotasunNOIzenak
178,C0338451,"anomic aphasia, behavioral disorder, change, dementia, language disorder, memory disorder, motor disorder, primary progressive aphasia",,
178,C0002395,"challenges in planning or solving problems, changes in mood and personality, confusion with time and space, decreased or poor judgment, dementia, difficulty completing familiar tasks at home,  at work or at leisure, memory loss that disrupts daily life, misplacing things and losing the ability to retrace steps, problems with words in speaking or writing, trouble understanding visual images and spatial relationships, withdrawal from work or social activities",,
178,C0011269,dementia,,
178,C0752347,"dementia, hallucination, parkinsonian syndrome",,
178,C0022336,"dementia, myoclonus",,
