erantzunZbkia,gaixotasunIzenOrig,gaixotasunIzenLev,sintomak
10,"bilis,  quiste,  drenaje,  drenaje,  punción,  drenaje,  bilis,  quiste,  dolor abdominal","tuberculosis, Desorden de identidad de la integridad corporal, -, -, -, -, -, -, -, -","adelgazamiento,fiebre,hemoptisis,tos, -, -, -, -, -, -, -, -, -"
10,,,
10,"quiste,  dilatación,  drenaje,  drenaje,  drenaje,  quiste","-, -, -, -, -, -","-, -, -, -, -, -"
10,"quiste,  quiste","-, -","-, -"
10,"quiste,  drenaje,  drenaje,  drenaje,  quiste","-, -, -, -, -","-, -, -, -, -"
