erantzunZbkia,gaixotasunIzenOrig,gaixotasunIzenLev,sintomak
336,"Trastorno depresivo mayor,  Trastorno depresivo mayor","-, -","-, -"
336,Trastorno obsesivo compulsivo,"trastorno obsesivo-compulsivo, trastorno obsesivo-compulsivo","ansiedad,compulsión,obsesión,pensamiento intrusivo, ansiedad,compulsión,obsesión,pensamiento intrusivo"
336,,,
336,Trastorno obsesivo compulsivo,"trastorno obsesivo-compulsivo, trastorno obsesivo-compulsivo","ansiedad,compulsión,obsesión,pensamiento intrusivo, ansiedad,compulsión,obsesión,pensamiento intrusivo"
336,,,
