erantzunZbkia,gaixotasunCodes,sintomak,gaixotasunNOCodes,gaixotasunNOIzenak
105,C0021345,"Esplenomegalia, Linfocitosis, Q102187500, adenopatía, amigdalitis, eflorescencia, fiebre, hepatomegalia, leucocitosis",,
105,C0586989,-,,
105,C0040558,"Esplenomegalia, Q480971, adenopatía, encefalitis, hepatomegalia, hepatosplenomegalia",,
105,C0024198,"Miocardiopatía hipertrófica, Q1634879, artralgia, artritis, cansancio, cefalea, dolor neuropático crónico, eritema crónico migratorio, fasciculación, fiebre, meningitis, meningoencefalitis, mialgia, miocarditis, neuritis, parestesia, trastorno del ritmo cardíaco, vértigo",,
105,C0009450,-,C0042776,virus herpes
