erantzunZbkia,gaixotasunCodes,sintomak,gaixotasunNOCodes,gaixotasunNOIzenak
102,,,"C1997614, C0032961, C0549169, C0549206, C0449438, C1301808 -","tromboembolia (venosa ), gestación, gestación, gestación, estado (protrombótico ), estado (protrombótico )"
102,,,"C0032961, C0233066, C0549169, C0549206","gestación, puerperio inmediato, gestación, gestación"
102,C0398623,-,"C0032961, C0086839, C0233958, C0549169, C0549206, C1879329","gestación, puerperio, puerperio, gestación, gestación, puerperio"
102,,,"C0032961, C0086839, C0233958, C0549169, C0549206, C1879329","gestación, puerperio, puerperio, gestación, gestación, puerperio"
102,,,"C0032961, C0549169, C0549206","gestación, gestación, gestación"
