erantzunZbkia,gaixotasunCodes,sintomak,gaixotasunNOCodes,gaixotasunNOIzenak
297,,,"C0011168, C0232520, C0011168, C0232520","disfagia (neurológica completa ), disfagia (neurológica completa ), disfagia (neurológica completa ), disfagia (neurológica completa )"
297,,,"C0006625, C0333399, C0750417, C0006625, C0085393, C0750417","Caquexia ((Causado por: empiema(crónico ))), empiema (crónico ), Caquexia ((Causado por: empiema(crónico ))), Caquexia ((Causado por: empiema(crónico ))), paciente inmunodeprimido, Caquexia ((Causado por: empiema(crónico )))"
297,,,,
297,"C0012634, C0039082, C0012634","-, -, -",C0039082 C0332285 -,Enfermedad (de Alzheimer avanzada )
297,,,,
