erantzunZbkia,gaixotasunIzenOrig,gaixotasunIzenLev,sintomak
10,"Cyst,  Abdominal Pain,   body substance Discharge","cyst, cyst, cystic, mucinous, and serous neoplasms, cystic, mucinous, and serous neoplasms, cystic, mucinous, and serous neoplasms, cystic, mucinous, and serous neoplasms, placental site trophoblastic tumor, Cat eye syndrome, congenital rubella syndrome, transient myeloproliferative syndrome, autosomal recessive palmoplantar keratoderma and congenital alopecia, metaphyseal chondrodysplasia, Spahr type, craniosynostosis 5, susceptibility to, craniosynostosis 6, cytokine release syndrome, cytokine release syndrome, sucrose intolerance, Coffin-Lowry syndrome, Developmental verbal dyspraxia, catecholaminergic polymorphic ventricular tachycardia, cyclic vomiting syndrome, Systemic primary carnitine deficiency, endodermal sinus tumor, cold-induced sweating syndrome, Calcifying epithelial odontogenic tumor, endolymphatic sac tumor, Carney's triad, congenital amegakaryocytic thrombocytopenia, Cranio–lenticulo–sutural dysplasia, Michelin tire baby syndrome, Rocker bottom foot, Charcot-Marie-Tooth disease type 1C, Cenani-Lenz syndactyly syndrome, congenital myasthenic syndrome 8, congenital myasthenic syndrome 7, congenital myasthenic syndrome 5, congenital myasthenic syndrome 9, congenital myasthenic syndrome 6, Coffin-Siris syndrome 2, Coffin-Siris syndrome 3, Coffin-Siris syndrome 4, cognitive impairment with or without cerebellar ataxia, postaxial polydactyly-anterior pituitary anomalies-facial dysmorphism syndrome, Cowden syndrome 7, Coffin-Siris syndrome 5, nystagmus 1, congenital, X-linked, cone-rod synaptic disorder, congenital nonprogressive, complement component C1s deficiency, carpal tunnel syndrome, chronic fatigue syndrome, thrombosis, meibomian cyst, Chediak-Higashi syndrome, cerebral venous sinus thrombosis, cerebral creatine deficiency syndrome, parovarian cyst, parovarian cyst, parovarian cyst, parovarian cyst, parovarian cyst, lung clear cell-sugar-tumor, sclerosteosis 1, Coffin-Siris syndrome 1, Coffin-Siris syndrome 6, congenital nystagmus 5, chronic spontaneous urticaria, Cerebellar agenesis, Cerebellar agenesis, cold urticaria, Charles Bonnet syndrome, central nervous system cyst, central nervous system cyst, central nervous system cyst, central nervous system cyst, cat-scratch disease, gastrointestinal stromal tumor, kidney clear cell sarcoma, clinically isolated syndrome, child sex tourism, cytokine storm, Cat, Cohen syndrome, Cohen syndrome, mustard gas, Rust, cephalothin, -, -","-, -, -, -, -, -, -, -, -, -, -, -, -, -, -, -, -, -, -, ventricular tachycardia, Hyperemesis,abdominal pain,fatigue,nausea, -, -, -, -, -, -, -, -, -, -, -, -, -, -, -, -, -, -, -, -, -, -, -, -, -, -, -, wrist pain, Post-exertional malaise,arthralgia,chills,chronic widespread pain,headache,lymph node,myalgia,night sweats,obnubilation,sore throat, -, -, -, asthenia,convulsion,headache, -, -, -, -, -, -, -, -, -, -, -, -, -, -, -, -, -, -, -, -, chills, -, -, -, -, -, -, -, -, -, -, -, -, -"
10,,,
10,body substance Discharge,-,-
10,Cyst,"cyst, cyst, cystic, mucinous, and serous neoplasms, cystic, mucinous, and serous neoplasms, cystic, mucinous, and serous neoplasms, cystic, mucinous, and serous neoplasms, placental site trophoblastic tumor, Cat eye syndrome, congenital rubella syndrome, transient myeloproliferative syndrome, autosomal recessive palmoplantar keratoderma and congenital alopecia, metaphyseal chondrodysplasia, Spahr type, craniosynostosis 5, susceptibility to, craniosynostosis 6, cytokine release syndrome, cytokine release syndrome, sucrose intolerance, Coffin-Lowry syndrome, Developmental verbal dyspraxia, catecholaminergic polymorphic ventricular tachycardia, cyclic vomiting syndrome, Systemic primary carnitine deficiency, endodermal sinus tumor, cold-induced sweating syndrome, Calcifying epithelial odontogenic tumor, endolymphatic sac tumor, Carney's triad, congenital amegakaryocytic thrombocytopenia, Cranio–lenticulo–sutural dysplasia, Michelin tire baby syndrome, Rocker bottom foot, Charcot-Marie-Tooth disease type 1C, Cenani-Lenz syndactyly syndrome, congenital myasthenic syndrome 8, congenital myasthenic syndrome 7, congenital myasthenic syndrome 5, congenital myasthenic syndrome 9, congenital myasthenic syndrome 6, Coffin-Siris syndrome 2, Coffin-Siris syndrome 3, Coffin-Siris syndrome 4, cognitive impairment with or without cerebellar ataxia, postaxial polydactyly-anterior pituitary anomalies-facial dysmorphism syndrome, Cowden syndrome 7, Coffin-Siris syndrome 5, nystagmus 1, congenital, X-linked, cone-rod synaptic disorder, congenital nonprogressive, complement component C1s deficiency, carpal tunnel syndrome, chronic fatigue syndrome, thrombosis, meibomian cyst, Chediak-Higashi syndrome, cerebral venous sinus thrombosis, cerebral creatine deficiency syndrome, parovarian cyst, parovarian cyst, parovarian cyst, parovarian cyst, parovarian cyst, lung clear cell-sugar-tumor, sclerosteosis 1, Coffin-Siris syndrome 1, Coffin-Siris syndrome 6, congenital nystagmus 5, chronic spontaneous urticaria, Cerebellar agenesis, Cerebellar agenesis, cold urticaria, Charles Bonnet syndrome, central nervous system cyst, central nervous system cyst, central nervous system cyst, central nervous system cyst, cat-scratch disease, gastrointestinal stromal tumor, kidney clear cell sarcoma, clinically isolated syndrome, child sex tourism, cytokine storm, Cat, Cohen syndrome, Cohen syndrome, mustard gas, Rust, cephalothin","-, -, -, -, -, -, -, -, -, -, -, -, -, -, -, -, -, -, -, ventricular tachycardia, Hyperemesis,abdominal pain,fatigue,nausea, -, -, -, -, -, -, -, -, -, -, -, -, -, -, -, -, -, -, -, -, -, -, -, -, -, -, -, wrist pain, Post-exertional malaise,arthralgia,chills,chronic widespread pain,headache,lymph node,myalgia,night sweats,obnubilation,sore throat, -, -, -, asthenia,convulsion,headache, -, -, -, -, -, -, -, -, -, -, -, -, -, -, -, -, -, -, -, -, chills, -, -, -, -, -, -, -, -, -, -, -"
10,"Cyst,   body substance Discharge","cyst, cyst, cystic, mucinous, and serous neoplasms, cystic, mucinous, and serous neoplasms, cystic, mucinous, and serous neoplasms, cystic, mucinous, and serous neoplasms, placental site trophoblastic tumor, Cat eye syndrome, congenital rubella syndrome, transient myeloproliferative syndrome, autosomal recessive palmoplantar keratoderma and congenital alopecia, metaphyseal chondrodysplasia, Spahr type, craniosynostosis 5, susceptibility to, craniosynostosis 6, cytokine release syndrome, cytokine release syndrome, sucrose intolerance, Coffin-Lowry syndrome, Developmental verbal dyspraxia, catecholaminergic polymorphic ventricular tachycardia, cyclic vomiting syndrome, Systemic primary carnitine deficiency, endodermal sinus tumor, cold-induced sweating syndrome, Calcifying epithelial odontogenic tumor, endolymphatic sac tumor, Carney's triad, congenital amegakaryocytic thrombocytopenia, Cranio–lenticulo–sutural dysplasia, Michelin tire baby syndrome, Rocker bottom foot, Charcot-Marie-Tooth disease type 1C, Cenani-Lenz syndactyly syndrome, congenital myasthenic syndrome 8, congenital myasthenic syndrome 7, congenital myasthenic syndrome 5, congenital myasthenic syndrome 9, congenital myasthenic syndrome 6, Coffin-Siris syndrome 2, Coffin-Siris syndrome 3, Coffin-Siris syndrome 4, cognitive impairment with or without cerebellar ataxia, postaxial polydactyly-anterior pituitary anomalies-facial dysmorphism syndrome, Cowden syndrome 7, Coffin-Siris syndrome 5, nystagmus 1, congenital, X-linked, cone-rod synaptic disorder, congenital nonprogressive, complement component C1s deficiency, carpal tunnel syndrome, chronic fatigue syndrome, thrombosis, meibomian cyst, Chediak-Higashi syndrome, cerebral venous sinus thrombosis, cerebral creatine deficiency syndrome, parovarian cyst, parovarian cyst, parovarian cyst, parovarian cyst, parovarian cyst, lung clear cell-sugar-tumor, sclerosteosis 1, Coffin-Siris syndrome 1, Coffin-Siris syndrome 6, congenital nystagmus 5, chronic spontaneous urticaria, Cerebellar agenesis, Cerebellar agenesis, cold urticaria, Charles Bonnet syndrome, central nervous system cyst, central nervous system cyst, central nervous system cyst, central nervous system cyst, cat-scratch disease, gastrointestinal stromal tumor, kidney clear cell sarcoma, clinically isolated syndrome, child sex tourism, cytokine storm, Cat, Cohen syndrome, Cohen syndrome, mustard gas, Rust, cephalothin, -","-, -, -, -, -, -, -, -, -, -, -, -, -, -, -, -, -, -, -, ventricular tachycardia, Hyperemesis,abdominal pain,fatigue,nausea, -, -, -, -, -, -, -, -, -, -, -, -, -, -, -, -, -, -, -, -, -, -, -, -, -, -, -, wrist pain, Post-exertional malaise,arthralgia,chills,chronic widespread pain,headache,lymph node,myalgia,night sweats,obnubilation,sore throat, -, -, -, asthenia,convulsion,headache, -, -, -, -, -, -, -, -, -, -, -, -, -, -, -, -, -, -, -, -, chills, -, -, -, -, -, -, -, -, -, -, -, -"
