erantzunZbkia,gaixotasunIzenOrig,gaixotasunIzenLev,sintomak
288,Diarrhea#  Non-specific Back Pain,"Leiner's disease, Chronic diarrhea of infancy, acute diarrhea, chronic diarrhea with villous atrophy, microvillus inclusion disease, microvillus inclusion disease, congenital diarrhea 5 with tufting enteropathy, congenital diarrhea 5 with tufting enteropathy, congenital secretory sodium diarrhea 8, congenital diarrhea 7 with exudative enteropathy, congenital diarrhea 7 with exudative enteropathy, congenital malabsorptive diarrhea 4, congenital malabsorptive diarrhea 4, congenital diarrhea 6, congenital diarrhea 6, congenital secretory sodium diarrhea 3, congenital secretory sodium diarrhea 3, congenital secretory sodium diarrhea 3, diarrhea, diarrhea, congenital diarrhea, trichohepatoenteric syndrome 1, trichohepatoenteric syndrome 1, sciatica, immune dysregulation-polyendocrinopathy-enteropathy-X-linked syndrome# -","-, -, diarrhea, -, -, -, -, -, -, diarrhea, diarrhea, -, -, diarrhea, diarrhea, diarrhea, diarrhea, diarrhea, -, -, diarrhea, -, -, -, diarrhea# -"
288,,,
288,Idiopathic chronic inflammatory bowel disease#  Spondylarthritis,-# -,-# -
288,Diarrhea,"Leiner's disease, Chronic diarrhea of infancy, acute diarrhea, chronic diarrhea with villous atrophy, microvillus inclusion disease, microvillus inclusion disease, congenital diarrhea 5 with tufting enteropathy, congenital diarrhea 5 with tufting enteropathy, congenital secretory sodium diarrhea 8, congenital diarrhea 7 with exudative enteropathy, congenital diarrhea 7 with exudative enteropathy, congenital malabsorptive diarrhea 4, congenital malabsorptive diarrhea 4, congenital diarrhea 6, congenital diarrhea 6, congenital secretory sodium diarrhea 3, congenital secretory sodium diarrhea 3, congenital secretory sodium diarrhea 3, diarrhea, diarrhea, congenital diarrhea, trichohepatoenteric syndrome 1, trichohepatoenteric syndrome 1, sciatica, immune dysregulation-polyendocrinopathy-enteropathy-X-linked syndrome","-, -, diarrhea, -, -, -, -, -, -, diarrhea, diarrhea, -, -, diarrhea, diarrhea, diarrhea, diarrhea, diarrhea, -, -, diarrhea, -, -, -, diarrhea"
288,,,
