erantzunZbkia,gaixotasunCodes,sintomak,gaixotasunNOCodes,gaixotasunNOIzenak,erantzunZbkia,gaixotasunIzenOrig,gaixotasunIzenLev,sintomak,erantzunZbkia,gaixotasunIzenOrig,gaixotasunIzenLev,sintomak,erantzunZbkia,gaixotasunCodes,sintomak,gaixotasunNOCodes,gaixotasunNOIzenak,erantzunZbkia,gaixotasunIzenOrig,gaixotasunIzenLev,sintomak
140,,,,,140,Behçet,-,-,140,,,,140,C0004943,"abdominal pain, acne, aphthous stomatitis, arthritis, aseptic meningitis, chronic widespread pain, cough, cutaneous pustular vasculitis, diarrhea, erythema nodosum, fever, hemoptysis, hypopyon, inflammation, meningoencephalitis, nausea, pathergy, pericarditis, pleurisy, retinal vasculitis, ulceration of vulva, uveitis",,,140,,,
140,C0012634# C0039082# C0085435# C0012634,-# -# -# -,C0039082 C0332285,Síndrome de,140,,,,140,,,,140,C0039082# C0085435,-# -,,,140,Síndrome de,"Síndrome FG, Defectos congénitos de la glicosilación, síndrome metabólico","-, -, -"
140,C0085077,reacción alérgica,,,140,,,,140,,,,140,C0085077,allergic response,,,140,,,
140,,,C0011155,Déficit,140,,,,140,,,,140,C0042842,-,,,140,Déficit,-,-
140,C0009450,-,C0027573,Gonococo,140,,,,140,,,,140,C0018081,"dysuria, excretion, pain, pelvic pain, testicular pain, vaginal discharge",,,140,Gonococo,"gonorrea, gonococia","disuria,dolor,dolor pélvico,escroto agudo,excreción,secreción vaginal, -"
