erantzunZbkia,gaixotasunCodes,sintomak,gaixotasunNOCodes,gaixotasunNOIzenak,erantzunZbkia,gaixotasunIzenOrig,gaixotasunIzenLev,sintomak,erantzunZbkia,gaixotasunIzenOrig,gaixotasunIzenLev,sintomak,erantzunZbkia,gaixotasunCodes,sintomak,gaixotasunNOCodes,gaixotasunNOIzenak,erantzunZbkia,gaixotasunIzenOrig,gaixotasunIzenLev,sintomak
178,C0338451,"afasia progresiva primaria, anomia, cambio, demencia, desorden motor, trastorno de conducta, trastorno de la memoria, trastorno del lenguaje",,,178,,,,178,,,,178,C0338451,"anomic aphasia, behavioral disorder, change, dementia, language disorder, memory disorder, motor disorder, primary progressive aphasia",,,178,,,
178,C0002395,"abandono de las actividades laborales o sociales, cambios de humor y personalidad, confusión espacio-temporal, demencia, deterioro del juicio, dificultad para interpretar imágenes y evaluar distancias, dificultad para planear o resolver problemas, dificultad para realizar tareas familiares en casa,  en el trabajo o en el tiempo libre, problemas en la expresión oral o escrita, pérdida de cosas y de la capacidad de volver atrás, pérdida de memoria que interrumpe la vida cotidiana",,,178,,,,178,,,,178,C0002395,"challenges in planning or solving problems, changes in mood and personality, confusion with time and space, decreased or poor judgment, dementia, difficulty completing familiar tasks at home,  at work or at leisure, memory loss that disrupts daily life, misplacing things and losing the ability to retrace steps, problems with words in speaking or writing, trouble understanding visual images and spatial relationships, withdrawal from work or social activities",,,178,,,
178,C0011263# C0011269,demencia# demencia,C0600359,Demencia vascular,178,,,,178,,,,178,C0011269,dementia,,,178,Demencia vascular,-,-
178,C0012634# C0039082# C0085200,"-# -# alucinación, demencia, parkinsonismo",,,178,,,,178,,,,178,C0752347,"dementia, hallucination, parkinsonian syndrome",,,178,,,
178,C0012634# C0039082# C0012634,-# -# -,C0039082 C0332285,Enfermedad de Creutzfeldt-Jakob,178,,,,178,,,,178,C0022336,"dementia, myoclonus",,,178,Enfermedad de Creutzfeldt-Jakob,-,-
