erantzunZbkia,gaixotasunCodes,sintomak,gaixotasunNOCodes,gaixotasunNOIzenak,erantzunZbkia,gaixotasunIzenOrig,gaixotasunIzenLev,sintomak,erantzunZbkia,gaixotasunIzenOrig,gaixotasunIzenLev,sintomak,erantzunZbkia,gaixotasunCodes,sintomak,gaixotasunNOCodes,gaixotasunNOIzenak,erantzunZbkia,gaixotasunIzenOrig,gaixotasunIzenLev,sintomak
179,C0012634# C0039082# C0012634,-# -# -,C0039082 C0332285,Enfermedad de Huntington,179,,,,179,,,,179,C0020179,"choreatic disease, dementia, personality changes, weight loss",,,179,Enfermedad de Huntington,-,-
179,C0019202,"cambios en la personalidad, edema, ictericia, signo de la cara del panda gigante, uñas azules",,,179,,,,179,,,,179,C0019202,"blue nails, edema, face of the giant panda sign, jaundice, personality changes",,,179,,,
179,C0040517,tic,,,179,,,,179,,,,179,C0040517,tic,,,179,,,
179,C0152113,corea,,,179,,,,179,,,,179,C0152113,choreatic disease,,,179,,,
179,C0030567,"anormalidad de la marcha, espasticidad, hipocinesia, temblor",,,179,,,,179,,,,179,C0752105,-,,,179,,,
