erantzunZbkia,gaixotasunCodes,sintomak,gaixotasunNOCodes,gaixotasunNOIzenak,erantzunZbkia,gaixotasunIzenOrig,gaixotasunIzenLev,sintomak,erantzunZbkia,gaixotasunIzenOrig,gaixotasunIzenLev,sintomak,erantzunZbkia,gaixotasunCodes,sintomak,gaixotasunNOCodes,gaixotasunNOIzenak,erantzunZbkia,gaixotasunIzenOrig,gaixotasunIzenLev,sintomak
228,C0023290,"Esplenomegalia, adelgazamiento, anemia, anorexia, ascitis, diarrea, fiebre, hepatomegalia, hipertensión portal, hipotensión, taquicardia",,,228,,,,228,,,,228,C0023290,"anemia, anorexia, ascites, diarrhea, fever, hepatomegaly, hypotension, portal hypertension, splenomegaly, tachycardia, weight loss",,,228,,,
228,C0030312,-,C0042776# C1673307,virus C,228,cirrosis,"cirrosis hepática, infección viral, anemia hipocrómica","-, -, hipocromía",228,,,,228,C0023890# C0030312,-# -,,,228,virus C,-,-
228,,,C0600688,toxicidad,228,,,,228,Drug withdrawal syndrome,-,-,228,,,C0152128,Drug withdrawal syndrome,228,toxicidad,-,-
228,C0409974,"Q388169, artralgia, hinchazón",,,228,,,,228,,,,228,C0409974,"arthralgia, malar rash, swelling",,,228,,,
228,,,C0019682# C0458074,VIH,228,,,,228,,,,228,,,,,228,VIH,"enfermedad inflamatoria intestinal, vaginosis bacteriana, vertigo asociado a migraña, comunicación interauricular, virus del papiloma humano, artritis juvenil idiopática, síndrome urémico hemolítico, coagulación intravascular diseminada, trastorno afectivo estacional, virus de la inmunodeficiencia humana, diabetes mellitus tipo 1, hipertrofia ventricular izquierda, linfoma no-Hodgkin, Neoplasia intraepitelial vulvar, peritonitis infecciosa felina, Tic, II","-, -, -, -, -, -, -, -, -, -, polidipsia,polifagia,poliuria, -, -, -, -, -, -"
